{
  "id": "capsule-fixture",
  "version": 1,
  "nodeId": "node-fixture",
  "objective": "Exercise the minimum context contract",
  "sections": {
    "projectKernel": [],
    "task": [],
    "node": [],
    "evidence": [],
    "dependencyOutputs": [],
    "agentExperience": []
  },
  "tokenBudget": {"allocated": 1, "expandableTo": 1},
  "provenance": [],
  "dependencyHash": "fixture-hash"
}
